{
  "review_id": "yrgs-review-20260317-121952",
  "generated_at": "2026-03-17T12:19:52+08:00",
  "scope": "原力全体系治理系统专项晨会",
  "structure_changes": [
    "canonical counts: spaces=5, subjects=12, endpoints=5, accounts=7, modules=6, source_feeds=7, assets=25, orders=2, cashflows=1, tasks=5, threads=5, skills=3",
    "active threads=4, pending follow-up tasks=4, client spaces=2",
    "ontology tables=1"
  ],
  "external_signal_summary": [
    "今日 shortlist: none",
    "observation only=0, adoption queue=0",
    "env blockers=none"
  ],
  "top_risks": [
    "最高优先级活跃线程仍待推进: 完成原力治理主图",
    "存在待补证据/待拍板任务: 完成原力治理主图",
    "治理中层缺口: workflow-hardening"
  ],
  "candidate_actions": [
    {
      "id": "A",
      "title": "先补 workflow hardening",
      "problem": "workflow-hardening",
      "recommended_next_step": "补中层"
    },
    {
      "id": "B",
      "title": "先清理 overlap",
      "problem": "overlap",
      "recommended_next_step": "列清单"
    },
    {
      "id": "C",
      "title": "先优化 review 路由",
      "problem": "routing",
      "recommended_next_step": "补边界"
    }
  ],
  "seed_watch_items": [],
  "adoption_queue_count": 0,
  "env_blockers": [],
  "waiting_choice": "请只拍板一个动作：A",
  "recommended_action": "A"
}
